Sheet: Feuille1
N1: Total modifier
E2: 9 | F2: 8 | G2: 7 | H2: 6 | I2: 5 | J2: 4 | K2: 3 | L2: 2 | M2: 1 | N2: 0 | O2: -1 | P2: -2 | Q2: -3 | R2: -4 | S2: -5 | T2: -6 | U2: -7 | V2: -8 | W2: -9
C3: Dice roll | D3: 1 | E3: 0 | H3: 0 | K3: 0 | N3: Fumble | Q3: 0 | T3: 0 | W3: 0 | X3: 1 | AA3: Charac. | AB3: Modifier
D4: 2 | E4: of:=ROUNDDOWN(MAX([.$AB$24]+[.$AB$25]-[.$AB$26];1)) -> 3 | H4: of:=ROUNDDOWN(MAX([.$AB$24]/2+[.$AB$25]-[.$AB$26];1)) -> 1 | K4: 0 | Q4: 0 | T4: 0 | W4: 0 | X4: 2 | AA4: 1 | AB4: -5
D5: 3 | E5: of:=ROUNDDOWN(MAX([.$AB$24]+[.$AB$25]-[.$AB$26];1)) -> 3 | H5: of:=ROUNDDOWN(MAX([.$AB$24]/2+[.$AB$25]-[.$AB$26];1)) -> 1 | K5: of:=ROUNDDOWN(MAX([.$AB$24]/2+[.$AB$25]-[.$AB$26];1)) -> 1 | N5: Failure | Q5: 0 | T5: 0 | W5: 0 | X5: 3 | AA5: 2-3 | AB5: -4
D6: 4 | E6: of:=ROUNDDOWN(MAX([.$AB$24]+[.$AB$25]-[.$AB$26];1)) -> 3 | H6: of:=ROUNDDOWN(MAX([.$AB$24]/2+[.$AB$25]-[.$AB$26];1)) -> 1 | K6: of:=ROUNDDOWN(MAX([.$AB$24]/2+[.$AB$25]-[.$AB$26];1)) -> 1 | Q6: 0 | T6: 0 | W6: 0 | X6: 4 | AA6: 4-5 | AB6: -3
D7: 5 | E7: of:=ROUNDDOWN(MAX([.$AB$24]+[.$AB$25]-[.$AB$26];1)) -> 3 | H7: of:=ROUNDDOWN(MAX([.$AB$24]+[.$AB$25]-[.$AB$26];1)) -> 3 | K7: of:=ROUNDDOWN(MAX([.$AB$24]/2+[.$AB$25]-[.$AB$26];1)) -> 1 | Q7: 0 | T7: 0 | W7: 0 | X7: 5 | AA7: 6-7 | AB7: -2
D8: 6 | E8: of:=ROUNDDOWN(MAX([.$AB$24]+[.$AB$25]-[.$AB$26];1)) -> 3 | H8: of:=ROUNDDOWN(MAX([.$AB$24]+[.$AB$25]-[.$AB$26];1)) -> 3 | K8: of:=ROUNDDOWN(MAX([.$AB$24]/2+[.$AB$25]-[.$AB$26];1)) -> 1 | Q8: 0 | T8: 0 | W8: 0 | X8: 6 | AA8: 8-9 | AB8: -1
D9: 7 | E9: of:=ROUNDDOWN(MAX([.$AB$24]+[.$AB$25]-[.$AB$26];1)) -> 3 | H9: of:=ROUNDDOWN(MAX([.$AB$24]+[.$AB$25]-[.$AB$26];1)) -> 3 | K9: of:=ROUNDDOWN(MAX([.$AB$24]/2+[.$AB$25]-[.$AB$26];1)) -> 1 | Q9: 0 | T9: 0 | W9: 0 | X9: 7 | AA9: 10-11 | AB9: 0
D10: 8 | E10: of:=ROUNDDOWN(MAX([.$AB$24]+[.$AB$25]-[.$AB$26];1)) -> 3 | H10: of:=ROUNDDOWN(MAX([.$AB$24]+[.$AB$25]-[.$AB$26];1)) -> 3 | K10: of:=ROUNDDOWN(MAX([.$AB$24]+[.$AB$25]-[.$AB$26];1)) -> 3 | N10: Graze | Q10: 0 | T10: 0 | W10: 0 | X10: 8 | AA10: 12-13 | AB10: 1
D11: 9 | E11: of:=ROUNDDOWN(MAX([.$AB$24]+[.$AB$25]-[.$AB$26];1)) -> 3 | H11: of:=ROUNDDOWN(MAX([.$AB$24]+[.$AB$25]-[.$AB$26];1)) -> 3 | K11: of:=ROUNDDOWN(MAX([.$AB$24]+[.$AB$25]-[.$AB$26];1)) -> 3 | Q11: of:=ROUNDDOWN(MAX([.$AB$24]/2+[.$AB$25]-[.$AB$26];1)) -> 1 | T11: 0 | W11: 0 | X11: 9 | AA11: 14-15 | AB11: 2
D12: 10 | E12: of:=ROUNDDOWN(MAX([.$AB$24]+[.$AB$25]-[.$AB$26];1)) -> 3 | H12: of:=ROUNDDOWN(MAX([.$AB$24]+[.$AB$25]-[.$AB$26];1)) -> 3 | K12: of:=ROUNDDOWN(MAX([.$AB$24]+[.$AB$25]-[.$AB$26];1)) -> 3 | Q12: of:=ROUNDDOWN(MAX([.$AB$24]/2+[.$AB$25]-[.$AB$26];1)) -> 1 | T12: 0 | W12: 0 | X12: 10 | AA12: 16-17 | AB12: 3
D13: 11 | E13: of:=ROUNDDOWN(MAX([.$AB$27]*[.$AB$24]+[.$AB$25]-[.$AB$26];1)) -> 8 | H13: of:=ROUNDDOWN(MAX([.$AB$24]+[.$AB$25]-[.$AB$26];1)) -> 3 | K13: of:=ROUNDDOWN(MAX([.$AB$24]+[.$AB$25]-[.$AB$26];1)) -> 3 | Q13: of:=ROUNDDOWN(MAX([.$AB$24]/2+[.$AB$25]-[.$AB$26];1)) -> 1 | T13: 0 | W13: 0 | X13: 11 | AA13: 18-19 | AB13: 4
D14: 12 | E14: of:=ROUNDDOWN(MAX([.$AB$27]*[.$AB$24]+[.$AB$25]-[.$AB$26];1)) -> 8 | H14: of:=ROUNDDOWN(MAX([.$AB$24]+[.$AB$25]-[.$AB$26];1)) -> 3 | K14: of:=ROUNDDOWN(MAX([.$AB$24]+[.$AB$25]-[.$AB$26];1)) -> 3 | Q14: of:=ROUNDDOWN(MAX([.$AB$24]/2+[.$AB$25]-[.$AB$26];1)) -> 1 | T14: of:=ROUNDDOWN(MAX([.$AB$24]/2+[.$AB$25]-[.$AB$26];1)) -> 1 | W14: 0 | X14: 12 | AA14: 20-21 | AB14: 5
D15: 13 | E15: of:=ROUNDDOWN(MAX([.$AB$27]*[.$AB$24]+[.$AB$25]-[.$AB$26];1)) -> 8 | H15: of:=ROUNDDOWN(MAX([.$AB$24]+[.$AB$25]-[.$AB$26];1)) -> 3 | K15: of:=ROUNDDOWN(MAX([.$AB$24]+[.$AB$25]-[.$AB$26];1)) -> 3 | N15: Success | Q15: of:=ROUNDDOWN(MAX([.$AB$24]/2+[.$AB$25]-[.$AB$26];1)) -> 1 | T15: of:=ROUNDDOWN(MAX([.$AB$24]/2+[.$AB$25]-[.$AB$26];1)) -> 1 | W15: 0 | X15: 13 | AA15: 22-23 | AB15: 6
D16: 14 | E16: of:=ROUNDDOWN(MAX([.$AB$27]*[.$AB$24]+[.$AB$25]-[.$AB$26];1)) -> 8 | H16: of:=ROUNDDOWN(MAX([.$AB$27]*[.$AB$24]+[.$AB$25]-[.$AB$26];1)) -> 8 | K16: of:=ROUNDDOWN(MAX([.$AB$24]+[.$AB$25]-[.$AB$26];1)) -> 3 | Q16: of:=ROUNDDOWN(MAX([.$AB$24]+[.$AB$25]-[.$AB$26];1)) -> 3 | T16: of:=ROUNDDOWN(MAX([.$AB$24]/2+[.$AB$25]-[.$AB$26];1)) -> 1 | W16: 0 | X16: 14 | AA16: 24-25 | AB16: 7
D17: 15 | E17: of:=ROUNDDOWN(MAX([.$AB$27]*[.$AB$24]+[.$AB$25]-[.$AB$26];1)) -> 8 | H17: of:=ROUNDDOWN(MAX([.$AB$27]*[.$AB$24]+[.$AB$25]-[.$AB$26];1)) -> 8 | K17: of:=ROUNDDOWN(MAX([.$AB$24]+[.$AB$25]-[.$AB$26];1)) -> 3 | Q17: of:=ROUNDDOWN(MAX([.$AB$24]+[.$AB$25]-[.$AB$26];1)) -> 3 | T17: of:=ROUNDDOWN(MAX([.$AB$24]/2+[.$AB$25]-[.$AB$26];1)) -> 1 | W17: of:=ROUNDDOWN(MAX([.$AB$24]/2+[.$AB$25]-[.$AB$26];1)) -> 1 | X17: 15 | AA17: 26-27 | AB17: 8
D18: 16 | E18: of:=ROUNDDOWN(MAX([.$AB$27]*[.$AB$24]+[.$AB$25]-[.$AB$26];1)) -> 8 | H18: of:=ROUNDDOWN(MAX([.$AB$27]*[.$AB$24]+[.$AB$25]-[.$AB$26];1)) -> 8 | K18: of:=ROUNDDOWN(MAX([.$AB$24]+[.$AB$25]-[.$AB$26];1)) -> 3 | Q18: of:=ROUNDDOWN(MAX([.$AB$24]+[.$AB$25]-[.$AB$26];1)) -> 3 | T18: of:=ROUNDDOWN(MAX([.$AB$24]/2+[.$AB$25]-[.$AB$26];1)) -> 1 | W18: of:=ROUNDDOWN(MAX([.$AB$24]/2+[.$AB$25]-[.$AB$26];1)) -> 1 | X18: 16 | AA18: 28-29 | AB18: 9
D19: 17 | E19: of:=ROUNDDOWN(MAX([.$AB$27]*[.$AB$24]+[.$AB$25]-[.$AB$26];1)) -> 8 | H19: of:=ROUNDDOWN(MAX([.$AB$27]*[.$AB$24]+[.$AB$25]-[.$AB$26];1)) -> 8 | K19: of:=ROUNDDOWN(MAX([.$AB$27]*[.$AB$24]+[.$AB$25]-[.$AB$26];1)) -> 8 | Q19: of:=ROUNDDOWN(MAX([.$AB$24]+[.$AB$25]-[.$AB$26];1)) -> 3 | T19: of:=ROUNDDOWN(MAX([.$AB$24]+[.$AB$25]-[.$AB$26];1)) -> 3 | W19: of:=ROUNDDOWN(MAX([.$AB$24]/2+[.$AB$25]-[.$AB$26];1)) -> 1 | X19: 17 | AA19: 30 | AB19: 10
D20: 18 | E20: of:=ROUNDDOWN(MAX([.$AB$27]*[.$AB$24]+[.$AB$25]-[.$AB$26];1)) -> 8 | H20: of:=ROUNDDOWN(MAX([.$AB$27]*[.$AB$24]+[.$AB$25]-[.$AB$26];1)) -> 8 | K20: of:=ROUNDDOWN(MAX([.$AB$27]*[.$AB$24]+[.$AB$25]-[.$AB$26];1)) -> 8 | Q20: of:=ROUNDDOWN(MAX([.$AB$24]+[.$AB$25]-[.$AB$26];1)) -> 3 | T20: of:=ROUNDDOWN(MAX([.$AB$24]+[.$AB$25]-[.$AB$26];1)) -> 3 | W20: of:=ROUNDDOWN(MAX([.$AB$24]/2+[.$AB$25]-[.$AB$26];1)) -> 1 | X20: 18
D21: 19 | E21: of:=ROUNDDOWN(MAX([.$AB$27]*[.$AB$24]+[.$AB$25]-[.$AB$26];1)) -> 8 | H21: of:=ROUNDDOWN(MAX([.$AB$27]*[.$AB$24]+[.$AB$25]-[.$AB$26];1)) -> 8 | K21: of:=ROUNDDOWN(MAX([.$AB$27]*[.$AB$24]+[.$AB$25]-[.$AB$26];1)) -> 8 | Q21: of:=ROUNDDOWN(MAX([.$AB$24]+[.$AB$25]-[.$AB$26];1)) -> 3 | T21: of:=ROUNDDOWN(MAX([.$AB$24]+[.$AB$25]-[.$AB$26];1)) -> 3 | W21: of:=ROUNDDOWN(MAX([.$AB$24]/2+[.$AB$25]-[.$AB$26];1)) -> 1 | X21: 19
D22: 20 | E22: of:=ROUNDDOWN(MAX([.$AB$27]*[.$AB$24]+[.$AB$25]-[.$AB$26];1)) -> 8 | H22: of:=ROUNDDOWN(MAX([.$AB$27]*[.$AB$24]+[.$AB$25]-[.$AB$26];1)) -> 8 | K22: of:=ROUNDDOWN(MAX([.$AB$27]*[.$AB$24]+[.$AB$25]-[.$AB$26];1)) -> 8 | N22: Critical | Q22: of:=ROUNDDOWN(MAX([.$AB$27]*[.$AB$24]+[.$AB$25]-[.$AB$26];1)) -> 8 | T22: of:=ROUNDDOWN(MAX([.$AB$27]*[.$AB$24]+[.$AB$25]-[.$AB$26];1)) -> 8 | W22: of:=ROUNDDOWN(MAX([.$AB$27]*[.$AB$24]+[.$AB$25]-[.$AB$26];1)) -> 8 | X22: 20
D23: Success odds | E23: of:=[.F23]+5% -> 0.95 | F23: of:=[.G23]+5% -> 0.9 | G23: of:=[.H23]+5% -> 0.85 | H23: of:=[.I23]+5% -> 0.8 | I23: of:=[.J23]+5% -> 0.75 | J23: of:=[.K23]+5% -> 0.7 | K23: of:=[.L23]+5% -> 0.65 | L23: of:=[.M23]+5% -> 0.6 | M23: of:=[.N23]+5% -> 0.55 | N23: 0.5 | O23: of:=[.N23]-5% -> 0.45 | P23: of:=[.O23]-5% -> 0.4 | Q23: of:=[.P23]-5% -> 0.35 | R23: of:=[.Q23]-5% -> 0.3 | S23: of:=[.R23]-5% -> 0.25 | T23: of:=[.S23]-5% -> 0.2 | U23: of:=[.T23]-5% -> 0.15 | V23: of:=[.U23]-5% -> 0.1 | W23: of:=[.V23]-5% -> 0.0500000000000001
D24: Failure odds | E24: 0.05 | F24: 0.05 | G24: 0.05 | H24: 0.05 | I24: 0.05 | J24: of:=[.K24]-5% -> 0.05 | K24: of:=[.L24]-5% -> 0.1 | L24: of:=[.M24]-5% -> 0.15 | M24: of:=[.N24]-5% -> 0.2 | N24: 0.25 | O24: of:=[.N24]+5% -> 0.3 | P24: of:=[.O24]+5% -> 0.35 | Q24: of:=[.P24]+5% -> 0.4 | R24: of:=[.Q24]+5% -> 0.45 | S24: of:=[.R24]+5% -> 0.5 | T24: of:=[.S24]+5% -> 0.55 | U24: of:=[.T24]+5% -> 0.6 | V24: of:=[.U24]+5% -> 0.65 | W24: of:=[.V24]+5% -> 0.7 | AA24: Damage | AB24: 5
D25: Mean damage | E25: of:=AVERAGE([.E3:.E22]) -> 5.35 | H25: of:=AVERAGE([.H3:.H22]) -> 4.3 | K25: of:=AVERAGE([.K3:.K22]) -> 3.2 | Q25: of:=AVERAGE([.Q3:.Q22]) -> 1.55 | T25: of:=AVERAGE([.T3:.T22]) -> 1.1 | W25: of:=AVERAGE([.W3:.W22]) -> 0.65 | AA25: + MIG | AB25: 1
AA26: - Armor | AB26: 3
D27: The Total modifier is given by summing all modifiers: Characteristic modifier, Skill modifier, maybe Special Skill, then circumstancial modifiers, and finally substracting the Difficulty. | AA27: Crit. multiplier | AB27: 2